{
  "id": "ToolMapping",
  "version": "1.0.0",
  "title": "Tool Mapping",
  "description": "Forensic tool, configuration, and SOLVE-IT method-planning profile. Every investigative step names a versioned tool (or AnalyticTool) and, when planned, a SOLVE-IT technique.",
  "mission": "Make tool provenance and method selection first-class so later reviewers can reproduce what the lab actually did.",
  "air_gapped": true,
  "required_modules": [
    "uco.core",
    "uco.tool",
    "uco.configuration",
    "uco.action",
    "case.investigation"
  ],
  "recommended_modules": [
    "ext.solveit.solveit-core",
    "ext.solveit.solveit-tool-profile",
    "ext.toolcap.toolcap",
    "uco.analysis"
  ],
  "facet_sets": {
    "Tool": {
      "required": [],
      "recommended": ["ConfigurationEntryFacet"],
      "notes": "Tool is the instrument, never the evidence. Prefer ConfiguredTool when flags/rulesets matter."
    }
  },
  "spine_anchors": [
    "cac-core:InvestigativeAction",
    "cac-core:AssessmentResult"
  ],
  "upper_ontology_profiles": ["prov-o"],
  "related_recipes": [
    "docs/recipes/forensic-tool.md",
    "docs/recipes/configured-tool.md",
    "docs/recipes/starter-tool-run.md",
    "docs/recipes/solve-it-investigation-planning.md",
    "docs/recipes/solveit-plan-execution-provenance.md"
  ],
  "recipe_skeleton": {
    "summary": "Investigation + versioned Tool/ConfiguredTool + InvestigativeAction (+ optional SolveitInvestigativeAction).",
    "steps": [
      "Create Tool or ConfiguredTool with name, version, and configuration entries.",
      "Optionally record SOLVE-IT objective/technique via SolveitInvestigativeAction.",
      "Create InvestigativeAction with instrument, object, and result.",
      "Add ProvenanceRecord grouping the run.",
      "Do not attach FileFacet to the Tool."
    ]
  },
  "keywords": ["tool", "autopsy", "cellebrite", "solve-it", "configured", "provenance", "method"]
}
