{
  "id": "AirGappedFieldTriage",
  "version": "1.0.0",
  "title": "Air-Gapped Field Triage",
  "description": "Laptop-scale, zero-egress guidance for on-scene triage. Same core as MinimalForensics, with explicit advice to keep graphs small, hash at acquisition, and stay offline.",
  "mission": "Help a field examiner produce hash-verified CASE graphs with no network and without loading the CAC T-Box.",
  "air_gapped": true,
  "required_modules": [
    "uco.core",
    "uco.observable",
    "uco.action",
    "uco.tool",
    "uco.types",
    "case.investigation"
  ],
  "recommended_modules": [
    "uco.identity",
    "uco.location"
  ],
  "facet_sets": {
    "File": {
      "required": ["FileFacet", "ContentDataFacet"],
      "recommended": [],
      "notes": "Hash every file at acquisition. Prefer one focused graph per volume, device, or app when the seizure is large."
    },
    "Device": {
      "required": ["DeviceFacet"],
      "recommended": ["MobileDeviceFacet", "OperatingSystemFacet", "SIMCardFacet"]
    },
    "RasterPicture": {
      "required": ["FileFacet", "ContentDataFacet", "RasterPictureFacet"],
      "recommended": ["EXIFFacet"]
    }
  },
  "spine_anchors": [
    "cac-core:EnduringEntity",
    "cac-core:Artifact",
    "cac-core:InvestigativeAction"
  ],
  "upper_ontology_profiles": [],
  "related_recipes": [
    "docs/recipes/starter-filesystem-report.md",
    "docs/recipes/large-datasets.md",
    "docs/recipes/starter-mobile-extraction.md"
  ],
  "recipe_skeleton": {
    "summary": "One focused graph per device or volume; hash everything; never call the network.",
    "steps": [
      "Create one Investigation graph per volume, app, or device when the seizure is large — not one unbounded graph.",
      "Record Tool + InvestigativeAction for the triage collector.",
      "Emit File/Device/RasterPicture observables with the required Facet sets.",
      "Stay inside the published PERFORMANCE_GUIDE comfort zone for laptop RAM.",
      "Write JSON-LD locally; validate offline with case-utils."
    ]
  },
  "keywords": ["air-gap", "offline", "field", "triage", "laptop", "zero-egress"]
}
