{
  "id": "AirGappedFieldTriage",
  "version": "1.0.0",
  "title": "Air-Gapped Field Triage",
  "description": "Laptop-scale, zero-egress profile for on-scene triage. Same core as MinimalForensics plus explicit partitioning and hash-first integrity so a 16 GB workstation stays inside the PERFORMANCE_GUIDE comfort zone.",
  "mission": "Let an ICAC/field examiner produce partitioned, hash-verified CASE graphs with no network and no CAC T-Box load.",
  "air_gapped": true,
  "required_modules": [
    "uco.core",
    "uco.observable",
    "uco.action",
    "uco.tool",
    "uco.types",
    "case.investigation"
  ],
  "recommended_modules": [
    "uco.identity",
    "uco.location"
  ],
  "facet_sets": {
    "File": {
      "required": ["FileFacet", "ContentDataFacet"],
      "recommended": [],
      "notes": "Hash every file at acquisition. Partition the graph per volume or per app, not by arbitrary object count."
    },
    "Device": {
      "required": ["DeviceFacet"],
      "recommended": ["MobileDeviceFacet", "OperatingSystemFacet", "SIMCardFacet"]
    },
    "RasterPicture": {
      "required": ["FileFacet", "ContentDataFacet", "RasterPictureFacet"],
      "recommended": ["EXIFFacet"]
    }
  },
  "spine_anchors": [
    "cac-core:EnduringEntity",
    "cac-core:Artifact",
    "cac-core:InvestigativeAction"
  ],
  "upper_ontology_profiles": [],
  "related_recipes": [
    "docs/recipes/starter-filesystem-report.md",
    "docs/recipes/large-datasets.md",
    "docs/recipes/starter-mobile-extraction.md"
  ],
  "recipe_skeleton": {
    "summary": "One focused graph per forensic boundary; hash everything; never call the network.",
    "steps": [
      "Create one CASEGraph per volume, app, or device — not one giant graph.",
      "Record Tool + InvestigativeAction for the triage collector.",
      "Emit File/Device/RasterPicture observables with required Facet sets.",
      "Call estimate_triples() before serialize; stay under laptop RAM guidance.",
      "Write JSON-LD locally; validate offline with case-utils."
    ]
  },
  "keywords": ["air-gap", "offline", "field", "triage", "partition", "laptop", "zero-egress"]
}
